{
  "schemaVersion": 1,
  "requestID": "request.fixture.1",
  "battleID": "battle.fixture.1",
  "turn": 1,
  "trainerID": "trainer.fixture.1",
  "identity": {
    "saveLineageID": "save.fixture.1",
    "branchID": "branch.fixture.1",
    "sessionID": "session.fixture.1",
    "generation": 1,
    "sequence": 1,
    "phase": "action_selection",
    "eventCursor": 10,
    "observationHash": "0000000000000000000000000000000000000000000000000000000000000000",
    "romSHA256": "0000000000000000000000000000000000000000000000000000000000000000",
    "catalogVersion": "catalog.fixture.1"
  },
  "personality": {
    "aggression": 0.5,
    "caution": 0.5,
    "loyalty": 0.5
  },
  "strategicPosture": {
    "schemaVersion": 1,
    "postureID": "posture.fixture.1",
    "trainerID": "trainer.fixture.1",
    "branchID": "branch.fixture.1",
    "evidenceCutoff": 10,
    "objective": "balanced",
    "aggression": 0.5,
    "riskTolerance": 0.5,
    "switchPreference": 0.5,
    "itemPreference": 0.5,
    "evidenceIDs": []
  },
  "visibleState": {
    "mode": "single_trainer",
    "ownActive": {
      "speciesID": 1,
      "hp": 10,
      "maxHP": 20,
      "knownMoveIDs": [
        33
      ],
      "status": "none"
    },
    "opponentActive": {
      "revealedSpeciesID": 19,
      "publicHPFraction": 1,
      "revealedMoveIDs": [],
      "status": "none"
    },
    "weather": "none"
  },
  "authorizedOpponentKnowledge": [],
  "recentHistory": [],
  "legalActions": [
    {
      "legalActionID": "action.fixture.1",
      "kind": "move",
      "actorSlot": 0,
      "targetSlot": 1,
      "moveID": 33
    }
  ]
}
